{
  "id": "i-si-lan-e-po-poe",
  "title": "伊是咱的寶貝",
  "subtitle": "I sī Lán ê Pó-pòe",
  "composer": "陳明章 (Tân Bêng-chiong)",
  "lyricist": "陳明章 (Tân Bêng-chiong)",
  "key": "F",
  "timeSignature": "4/4",
  "bpm": 72,
  "notesPerLine": 4,
  "description": "陳明章詞曲創作經典臺灣歌謠《伊是咱的寶貝》(I sī Lán ê Pó-pòe)，F調 (4/4拍)。依照樂譜五線譜/簡譜標準精確轉換，包含完整白話字 (POJ) 與漢字對齊，短句分段好讀好唱。",
  "measures": [
    {
      "id": "m-1",
      "measureNumber": 1,
      "chord": "F",
      "section": "主歌 1-A",
      "notes": [
        { "id": "n-1-1", "pitch": 5, "octave": 0, "duration": 1.5, "isDotted": true, "slurToNext": true, "lyric": { "poj": "Chit", "hanlo": "一" } },
        { "id": "n-1-2", "pitch": 6, "octave": 0, "duration": 0.5, "lyric": { "poj": "lúi", "hanlo": "蕊" } },
        { "id": "n-1-3", "pitch": 3, "octave": 0, "duration": 2.0, "lyric": { "poj": "hoe", "hanlo": "花" } }
      ]
    },
    {
      "id": "m-2",
      "measureNumber": 2,
      "chord": "C",
      "isLineBreak": true,
      "notes": [
        { "id": "n-2-1", "pitch": 2, "octave": 0, "duration": 1.5, "isDotted": true, "slurToNext": true, "lyric": { "poj": "sìⁿ", "hanlo": "生" } },
        { "id": "n-2-2", "pitch": 3, "octave": 0, "duration": 0.5, "lyric": { "poj": "lo̍h", "hanlo": "落" } },
        { "id": "n-2-3", "pitch": 2, "octave": 0, "duration": 2.0, "lyric": { "poj": "tē,\n", "hanlo": "地，\n" } }
      ]
    },
    {
      "id": "m-3",
      "measureNumber": 3,
      "chord": "C7",
      "notes": [
        { "id": "n-3-1", "pitch": 2, "octave": 0, "duration": 0.5, "lyric": { "poj": "Pa", "hanlo": "爸" } },
        { "id": "n-3-2", "pitch": 2, "octave": 0, "duration": 0.5, "lyric": { "poj": "pa", "hanlo": "爸" } },
        { "id": "n-3-3", "pitch": 5, "octave": 0, "duration": 0.5, "lyric": { "poj": "ma", "hanlo": "媽" } },
        { "id": "n-3-4", "pitch": 6, "octave": 0, "duration": 0.5, "lyric": { "poj": "ma", "hanlo": "媽" } },
        { "id": "n-3-5", "pitch": 5, "octave": 0, "duration": 1.0, "lyric": { "poj": "thiàⁿ", "hanlo": "疼" } },
        { "id": "n-3-6", "pitch": 3, "octave": 0, "duration": 1.0, "lyric": { "poj": "siāng", "hanlo": "上" } }
      ]
    },
    {
      "id": "m-4",
      "measureNumber": 4,
      "chord": "F",
      "isLineBreak": true,
      "notes": [
        { "id": "n-4-1", "pitch": 1, "octave": 0, "duration": 4.0, "lyric": { "poj": "chē,\n", "hanlo": "多，\n" } }
      ]
    },
    {
      "id": "m-5",
      "measureNumber": 5,
      "chord": "F",
      "section": "主歌 1-B",
      "notes": [
        { "id": "n-5-1", "pitch": 5, "octave": 0, "duration": 1.5, "isDotted": true, "slurToNext": true, "lyric": { "poj": "Hong", "hanlo": "風" } },
        { "id": "n-5-2", "pitch": 6, "octave": 0, "duration": 0.5, "lyric": { "poj": "nā", "hanlo": "若" } },
        { "id": "n-5-3", "pitch": 3, "octave": 0, "duration": 2.0, "lyric": { "poj": "chhoe", "hanlo": "吹" } }
      ]
    },
    {
      "id": "m-6",
      "measureNumber": 6,
      "chord": "C",
      "isLineBreak": true,
      "notes": [
        { "id": "n-6-1", "pitch": 2, "octave": 0, "duration": 1.5, "isDotted": true, "slurToNext": true, "lyric": { "poj": "ài", "hanlo": "愛" } },
        { "id": "n-6-2", "pitch": 3, "octave": 0, "duration": 0.5, "lyric": { "poj": "kah", "hanlo": "甲" } },
        { "id": "n-6-3", "pitch": 2, "octave": 0, "duration": 2.0, "lyric": { "poj": "phōe,\n", "hanlo": "被，\n" } }
      ]
    },
    {
      "id": "m-7",
      "measureNumber": 7,
      "chord": "Bb",
      "notes": [
        { "id": "n-7-1", "pitch": 3, "octave": 0, "duration": 0.5, "lyric": { "poj": "M̄", "hanlo": "唔" } },
        { "id": "n-7-2", "pitch": 5, "octave": 0, "duration": 0.5, "lyric": { "poj": "thang", "hanlo": "通" } },
        { "id": "n-7-3", "pitch": 6, "octave": 0, "duration": 0.5, "lyric": { "poj": "hō͘", "hanlo": "互" } },
        { "id": "n-7-4", "pitch": 5, "octave": 0, "duration": 0.5, "lyric": { "poj": "i", "hanlo": "伊" } },
        { "id": "n-7-5", "pitch": 3, "octave": 0, "duration": 0.5, "lyric": { "poj": "tūi", "hanlo": "墜" } },
        { "id": "n-7-6", "pitch": 2, "octave": 0, "duration": 0.5, "lyric": { "poj": "lo̍h", "hanlo": "落" } },
        { "id": "n-7-7", "pitch": 2, "octave": 0, "duration": 0.5, "lyric": { "poj": "o͘", "hanlo": "黑" } },
        { "id": "n-7-8", "pitch": 3, "octave": 0, "duration": 0.5, "lyric": { "poj": "àm", "hanlo": "暗" } }
      ]
    },
    {
      "id": "m-8",
      "measureNumber": 8,
      "chord": "F",
      "isLineBreak": true,
      "notes": [
        { "id": "n-8-1", "pitch": 1, "octave": 0, "duration": 4.0, "lyric": { "poj": "tē;\n", "hanlo": "地，\n" } }
      ]
    },
    {
      "id": "m-9",
      "measureNumber": 9,
      "chord": "F",
      "section": "副歌 2-A",
      "notes": [
        { "id": "n-9-1", "pitch": 1, "octave": 0, "duration": 0.5, "lyric": { "poj": "Beh", "hanlo": "欲" } },
        { "id": "n-9-2", "pitch": 2, "octave": 0, "duration": 0.5, "lyric": { "poj": "khui", "hanlo": "開" } },
        { "id": "n-9-3", "pitch": 3, "octave": 0, "duration": 0.5, "lyric": { "poj": "ê", "hanlo": "的" } },
        { "id": "n-9-4", "pitch": 5, "octave": 0, "duration": 0.5, "lyric": { "poj": "hoe", "hanlo": "花" } },
        { "id": "n-9-5", "pitch": 3, "octave": 0, "duration": 0.5, "lyric": { "poj": "su", "hanlo": "需" } },
        { "id": "n-9-6", "pitch": 2, "octave": 0, "duration": 0.5, "lyric": { "poj": "iàu", "hanlo": "要" } },
        { "id": "n-9-7", "pitch": 1, "octave": 0, "duration": 0.5, "lyric": { "poj": "lí", "hanlo": "你" } },
        { "id": "n-9-8", "pitch": 2, "octave": 0, "duration": 0.5, "lyric": { "poj": "góa", "hanlo": "我" } }
      ]
    },
    {
      "id": "m-10",
      "measureNumber": 10,
      "chord": "C",
      "isLineBreak": true,
      "notes": [
        { "id": "n-10-1", "pitch": 3, "octave": 0, "duration": 1.0, "lyric": { "poj": "ê", "hanlo": "的" } },
        { "id": "n-10-2", "pitch": 1, "octave": 0, "duration": 1.0, "lyric": { "poj": "koan", "hanlo": "關" } },
        { "id": "n-10-3", "pitch": 2, "octave": 0, "duration": 2.0, "lyric": { "poj": "sim,\n", "hanlo": "心，\n" } }
      ]
    },
    {
      "id": "m-11",
      "measureNumber": 11,
      "chord": "Bb",
      "notes": [
        { "id": "n-11-1", "pitch": 2, "octave": 0, "duration": 0.5, "lyric": { "poj": "Hō͘", "hanlo": "互" } },
        { "id": "n-11-2", "pitch": 3, "octave": 0, "duration": 0.5, "lyric": { "poj": "i", "hanlo": "伊" } },
        { "id": "n-11-3", "pitch": 5, "octave": 0, "duration": 0.5, "lyric": { "poj": "chit", "hanlo": "一" } },
        { "id": "n-11-4", "pitch": 6, "octave": 0, "duration": 0.5, "lyric": { "poj": "phìⁿ", "hanlo": "片" } },
        { "id": "n-11-5", "pitch": 5, "octave": 0, "duration": 0.5, "lyric": { "poj": "seng", "hanlo": "生" } },
        { "id": "n-11-6", "pitch": 3, "octave": 0, "duration": 0.5, "lyric": { "poj": "tióng", "hanlo": "長" } },
        { "id": "n-11-7", "pitch": 2, "octave": 0, "duration": 0.5, "lyric": { "poj": "ê", "hanlo": "的" } },
        { "id": "n-11-8", "pitch": 3, "octave": 0, "duration": 0.5, "lyric": { "poj": "thó", "hanlo": "土" } }
      ]
    },
    {
      "id": "m-12",
      "measureNumber": 12,
      "chord": "F",
      "isLineBreak": true,
      "notes": [
        { "id": "n-12-1", "pitch": 1, "octave": 0, "duration": 4.0, "lyric": { "poj": "tē,\n", "hanlo": "地，\n" } }
      ]
    },
    {
      "id": "m-13",
      "measureNumber": 13,
      "chord": "F",
      "section": "副歌 2-B",
      "notes": [
        { "id": "n-13-1", "pitch": 1, "octave": 0, "duration": 0.5, "lyric": { "poj": "Chhiú", "hanlo": "手" } },
        { "id": "n-13-2", "pitch": 2, "octave": 0, "duration": 0.5, "lyric": { "poj": "khan", "hanlo": "牽" } },
        { "id": "n-13-3", "pitch": 3, "octave": 0, "duration": 1.0, "lyric": { "poj": "chhiú", "hanlo": "手" } },
        { "id": "n-13-4", "pitch": 2, "octave": 0, "duration": 0.5, "lyric": { "poj": "sim", "hanlo": "心" } },
        { "id": "n-13-5", "pitch": 3, "octave": 0, "duration": 0.5, "lyric": { "poj": "liân", "hanlo": "連" } },
        { "id": "n-13-6", "pitch": 5, "octave": 0, "duration": 1.0, "lyric": { "poj": "sim", "hanlo": "心" } }
      ]
    },
    {
      "id": "m-14",
      "measureNumber": 14,
      "chord": "Dm",
      "isLineBreak": true,
      "notes": [
        { "id": "n-14-1", "pitch": 6, "octave": 0, "duration": 1.0, "lyric": { "poj": "lán", "hanlo": "咱" } },
        { "id": "n-14-2", "pitch": 5, "octave": 0, "duration": 1.0, "lyric": { "poj": "khiā", "hanlo": "站" } },
        { "id": "n-14-3", "pitch": 2, "octave": 0, "duration": 0.5, "lyric": { "poj": "chò", "hanlo": "作" } },
        { "id": "n-14-4", "pitch": 2, "octave": 0, "duration": 0.5, "lyric": { "poj": "hóe,\n", "hanlo": "伙，\n" } },
        { "id": "n-14-5", "pitch": 0, "octave": 0, "duration": 1.0, "lyric": {} }
      ]
    },
    {
      "id": "m-15",
      "measureNumber": 15,
      "chord": "Bb",
      "notes": [
        { "id": "n-15-1", "pitch": 2, "octave": 0, "duration": 1.0, "lyric": { "poj": "I", "hanlo": "伊" } },
        { "id": "n-15-2", "pitch": 3, "octave": 0, "duration": 1.0, "lyric": { "poj": "sī", "hanlo": "是" } },
        { "id": "n-15-3", "pitch": 5, "octave": 0, "duration": 1.0, "lyric": { "poj": "lán", "hanlo": "咱" } },
        { "id": "n-15-4", "pitch": 6, "octave": 0, "duration": 1.0, "lyric": { "poj": "ê", "hanlo": "的" } }
      ]
    },
    {
      "id": "m-16",
      "measureNumber": 16,
      "chord": "F",
      "barlineType": "end",
      "isLineBreak": true,
      "notes": [
        { "id": "n-16-1", "pitch": 5, "octave": 0, "duration": 2.0, "slurToNext": true, "lyric": { "poj": "pó", "hanlo": "寶" } },
        { "id": "n-16-2", "pitch": 1, "octave": 0, "duration": 2.0, "lyric": { "poj": "pòe.\n", "hanlo": "貝。\n" } }
      ]
    }
  ]
}
